{"$schema":"https://json-schema.org/draft/2020-12/schema","$id":"https://leaduxai.id/schemas/content-strategist/strategy-memory.schema.json","title":"LeadUX Strategy Memory","type":"object","required":["memory_id","updated_at","published_content","performance_patterns","strategy_versions"],"properties":{"memory_id":{"type":"string"},"updated_at":{"type":"string"},"published_content":{"type":"array","items":{"type":"object","required":["content_id"],"properties":{"content_id":{"type":"string"},"brief_id":{"type":["string","null"]},"title":{"type":["string","null"]},"topic":{"type":["string","null"]},"angle":{"type":["string","null"]},"format":{"type":["string","null"]},"channel":{"type":["string","null"]},"published_at":{"type":["string","null"]},"pillar_id":{"type":["string","null"]},"content_opportunity_id":{"type":["string","null"]}},"additionalProperties":true}},"performance_patterns":{"type":"array","items":{"type":"object","required":["performance_pattern_id","statement","confidence"],"properties":{"performance_pattern_id":{"type":"string"},"statement":{"type":"string"},"supporting_observation_ids":{"type":"array","items":{"type":"string"}},"sample_size":{"type":["integer","null"]},"confidence":{"enum":["HIGH","MEDIUM","LOW"]},"causal_claim":{"type":"boolean"}},"additionalProperties":true}},"strategy_versions":{"type":"array","items":{"type":"object"}}},"additionalProperties":false}
