{
  "memory_id": "mem_demo",
  "updated_at": "2026-09-16T12:00:00Z",
  "published_content": [{"content_id":"content_old_001","brief_id":"brief_old","title":"Why automation setup takes longer than expected","topic":"automation setup","angle":"Hidden complexity in automation projects","format":"short-video","channel":"youtube","published_at":"2026-08-20","pillar_id":"pillar_001","content_opportunity_id":"cop_old"}],
  "performance_patterns": [],
  "strategy_versions": []
}
